{
  "logging": { "level": "DEBUG" },
  "heartbeat": {
    "intervalSecs": 5,
    "measures": { "cpu": true, "memory": true },
    "targets": [ { "type": "metric" } ]
  },
  "metricEmission": { "target": "log", "namespace": "demo" },
  "tags": { "site": "factory-1" },
  "component": {
    "global": { "publish_interval": 3 },
    "instances": [ { "id": "main" }, { "id": "second" } ]
  }
}
